"Trust-Oriented Multi-visualization of Cooperation Context","A. Guerriero; S. Kubicki; G. Halin","CRAI, Res. Centre in Archit. & Eng., Nancy, France; CRAI, Res. Centre in Archit. & Eng., Nancy, France; CRAI, Res. Centre in Archit. & Eng., Nancy, France",2009 Second International Conference in Visualisation,"4 Sep 2009","2009","","","96","101","The building construction activity is uncertain by nature because of its specificities (e.g. heterogeneous stakeholders, ephemeral teams, etc.) and particularly, because it corresponds to a particular mode of production ""on site"" and is submitted to variable conditions. So the construction management is essential to guarantee the correct progression of the construction activity. Moreover, trust is a central component in this type of activity to surmount the uncertainty. Therefore, we suggest making a connection between the coordination assistance tool and the notion of trust. This paper suggests representing trust in the correct progression of the activity in order to support the construction management and using this representation to guide user navigation in a multi-visualization environment. It will describe a methodology to identify trust information in a construction activity context, measure trust value and implement a trust-based prototype.","","978-0-7695-3734-4","10.1109/VIZ.2009.48","","https://ieeexplore.ieee.org/stamp/stamp.jsp?arnumber=5230720","Trust representation;AEC (Architecture Engineering and Construction);Construction management;Multi-visualization;Cooperation context;Coordination assistance","Buildings;Production;Prototypes;Uncertainty;Navigation;Meeting planning;Visualization;Environmental management;Design engineering;Engineering management","","4","","20","IEEE","4 Sep 2009","","","IEEE","IEEE Conferences"
"Trust visualization for object management in Internet of Things","H. Oh; S. Ahn; J. K. Choi; J. Yang","KAIST, School of Electrical Engineering, Daejeon, Republic of Korea; KAIST, School of Electrical Engineering, Daejeon, Republic of Korea; KAIST, School of Electrical Engineering, Daejeon, Republic of Korea; Department of Information and Communication Engineering, KAIST, Daejeon, Republic of Korea",2016 IEEE 5th Global Conference on Consumer Electronics,"29 Dec 2016","2016","","","1","2","This paper proposed trust visualization for object management in Internet of Things environment. Based on the proposed system, trust based object visualization methods are introduced. Actual implementation shows that graph-based trust visualization helps user perceptions to handle various related objects.","","978-1-5090-2333-2","10.1109/GCCE.2016.7800335","","https://ieeexplore.ieee.org/stamp/stamp.jsp?arnumber=7800335","Trust;Visualization;Internet of Things","","","2","","5","IEEE","29 Dec 2016","","","IEEE","IEEE Conferences"
"Visualizing SVG Mobile Web Services for a Trust Network","S. Mohammed; J. Fiaidhi; M. Lam","Department of Computer Science, Lakehead University, Thunder Bay, ONT, Canada; Department of Computer Science, Lakehead University, Thunder Bay, ONT, Canada; Department of Computer Science, Lakehead University, Thunder Bay, ONT, Canada",Geometric Modeling and Imaging (GMAI '07),"16 Jul 2007","2007","","","19","24","The widespread availability of World Wide Web gives the opportunities for delivering spatial data over the Internet as well as small mobile devices. In this paper we developed a scalable vector graphics (SVG) as Web services and presented a platform for the direct consumption of SVG Web services by a Mobile J2ME Stations. We give an architectural solution where Apache Axis plays the role of trusted third parties supplying service credentials that allow a safe visualization of SVG images.","","0-7695-2901-1","10.1109/GMAI.2007.33","","https://ieeexplore.ieee.org/stamp/stamp.jsp?arnumber=4271715","Web Services;TinyLine SVG;Trust;Network;Mobile Computing;Visualization.","Visualization;Web services;Mobile computing;Pervasive computing;XML;Web and internet services;Mobile agents;Mobile handsets;Network servers;Multimedia systems","","1","","","IEEE","16 Jul 2007","","","IEEE","IEEE Conferences"
"XTM collaborative argumentation-based trust assessment for layered sensing environments","D. Schiavone; E. Loomis; J. McCracken",Design Knowledge Company; Design Knowledge Company; Design Knowledge Company,2008 International Symposium on Collaborative Technologies and Systems,"17 Jun 2008","2008","","","83","87","The air force research laboratory's (AFRL) collaborative, trusted sensing research and development is critical to providing the warfighter much-needed universal situational awareness (USA). USA requires many different capabilities including the ability to rapidy correlate sensor data and provide at-a-glance decision support tools that provide a means to rapidly assess sensor web trustworthiness and overall system health/status. The design knowledge company (TDKC) is currently developing the XTM collaborative argumentation toolkit (XCAT) for the AFRL's Sensor Directorate. XCAT will provide a next-generation capability to manage sensor data streams, parameterize sensor network quality of service and level of trust, and correlate the sensor information with other intelligence data. XCAT will also provide argumentation tools to assist with decision making and course-of-action selections.","","978-1-4244-2248-7","10.1109/CTS.2008.4543916","","https://ieeexplore.ieee.org/stamp/stamp.jsp?arnumber=4543916","Collaborative environements;trusted layered sensing;decision support;arugmentation;visualization","Collaboration;Intelligent sensors;Sensor systems;Force sensors;Laboratories;Research and development;Collaborative tools;Next generation networking;Quality management;Quality of service","","","","7","IEEE","17 Jun 2008","","","IEEE","IEEE Conferences"
"RMExplorer: A Visual Analytics Approach to Explore the Performance and the Fairness of Disease Risk Models on Population Subgroups","B. C. Kwon; U. Kartoun; S. Khurshid; M. Yurochkin; S. Maity; D. G. Brockman; A. V. Khera; P. T. Ellinor; S. A. Lubitz; K. Ng",IBM Research; IBM Research; IBM Research; IBM Research; Broad Institute; University of Michigan; University of Michigan; University of Michigan; University of Michigan; IBM Research,2022 IEEE Visualization and Visual Analytics (VIS),"14 Dec 2022","2022","","","50","54","Disease risk models can identify high-risk patients and help clinicians provide more personalized care. However, risk models de-veloped on one dataset may not generalize across diverse subpop-ulations of patients in different datasets and may have unexpected performance. It is challenging for clinical researchers to inspect risk models across different subgroups without any tools. Therefore, we developed an interactive visualization system called RMExplorer (Risk Model Explorer) to enable interactive risk model assessment. Specifically, the system allows users to define subgroups of patients by selecting clinical, demographic, or other characteristics, to ex-plore the performance and fairness of risk models on the subgroups, and to understand the feature contributions to risk scores. To demonstrate the usefulness of the tool, we conduct a case study, where we use RMExplorer to explore three atrial fibrillation risk models by applying them to the UK Biobank dataset of 445,329 individuals. RMExplorer can help researchers to evaluate the performance and biases of risk models on subpopulations of interest in their data.","2771-9553","978-1-6654-8812-9","10.1109/VIS54862.2022.00019","","https://ieeexplore.ieee.org/stamp/stamp.jsp?arnumber=9973226","visual analytics;health informatics;fairness;subgroup analysis;explainability;interpretability;electronic health records;Human-centered computing;Visualization","Analytical models;Biological system modeling;Visual analytics;Computational modeling;Sociology;Data visualization;Atrial fibrillation","","2","","30","IEEE","14 Dec 2022","","","IEEE","IEEE Conferences"
"Selection Bias Tracking and Detailed Subset Comparison for High-Dimensional Data","D. Borland; W. Wang; J. Zhang; J. Shrestha; D. Gotz","RENCI, University of North Carolina, Chapel Hill; School of Information and Library Science, University of North Carolina, Chapel Hill; Dept. of Biostatistics, University of North Carolina, Chapel Hill; Dept. of Computer Science, University of North Carolina, Chapel Hill; School of Information and Library Science, University of North Carolina, Chapel Hill",IEEE Transactions on Visualization and Computer Graphics,"25 Nov 2019","2020","26","1","429","439","The collection of large, complex datasets has become common across a wide variety of domains. Visual analytics tools increasingly play a key role in exploring and answering complex questions about these large datasets. However, many visualizations are not designed to concurrently visualize the large number of dimensions present in complex datasets (e.g. tens of thousands of distinct codes in an electronic health record system). This fact, combined with the ability of many visual analytics systems to enable rapid, ad-hoc specification of groups, or cohorts, of individuals based on a small subset of visualized dimensions, leads to the possibility of introducing selection bias–when the user creates a cohort based on a specified set of dimensions, differences across many other unseen dimensions may also be introduced. These unintended side effects may result in the cohort no longer being representative of the larger population intended to be studied, which can negatively affect the validity of subsequent analyses. We present techniques for selection bias tracking and visualization that can be incorporated into high-dimensional exploratory visual analytics systems, with a focus on medical data with existing data hierarchies. These techniques include: (1) tree-based cohort provenance and visualization, including a user-specified baseline cohort that all other cohorts are compared against, and visual encoding of cohort “drift”, which indicates where selection bias may have occurred, and (2) a set of visualizations, including a novel icicle-plot based visualization, to compare in detail the per-dimension differences between the baseline and a user-specified focus cohort. These techniques are integrated into a medical temporal event sequence visual analytics tool. We present example use cases and report findings from domain expert user interviews.","1941-0506","","10.1109/TVCG.2019.2934209","National Science Foundation(grant numbers:1704018); ","https://ieeexplore.ieee.org/stamp/stamp.jsp?arnumber=8807213","High-dimensional visualization;visual analytics;cohort selection;medical informatics;selection bias","Data visualization;Visual analytics;Encoding;Tools;Complexity theory;Medical diagnostic imaging","","9","","57","IEEE","20 Aug 2019","","","IEEE","IEEE Journals"
"Visualizing Transaction Context in Trust and Reputation Systems","J. Sänger; G. Pernul","Department of Information Systems, University of Regensburg, Regensburg, Germany; Department of Information Systems, University of Regensburg, Regensburg, Germany","2014 Ninth International Conference on Availability, Reliability and Security","11 Dec 2014","2014","","","94","103","Transaction context is an important aspect that should be taken into account for reputation-based trust assessment, because referrals are bound to the situation-specific context in which they were created. The non-consideration of transaction context may cause several threats such as the value imbalance problem. Exploiting this weakness, a seller can build high reputation by selling cheap products while cheating on the expensive ones. In the recent years, multiple approaches have been introduced that address this challenge. All of them chose metrics leading to numerical reputation values. These values, however, are non-transparent and quite hard to understand for the end-user. In this work, in contrast, we combine reputation assessment and visual analytics to provide an interactive visualization of multivariate reputation data. We thereby allow the user to analyze the data sets and draw conclusions by himself. In this way, we enhance transparency, involve the user in the evaluation process and as a consequence increase the users' trust in the reputation system.","","978-1-4799-4223-7","10.1109/ARES.2014.19","","https://ieeexplore.ieee.org/stamp/stamp.jsp?arnumber=6980268","trust;reputation;context;transaction context;context-awareness;visual analytics;visualization;parallel coordinates","Context;Data visualization;Visual analytics;Biological system modeling;Context modeling;Measurement;Electronic commerce","","5","","29","IEEE","11 Dec 2014","","","IEEE","IEEE Conferences"
"From Invisible to Visible: Impacts of Metadata in Communicative Data Visualization","A. Burns; C. Lee; T. On; C. Xiong; E. Peck; N. Mahyar","Mount Holyoke College, South Hadley, MA, USA; University of Massachusetts Amherst, Amherst, MA, USA; University of Massachusetts Amherst, Amherst, MA, USA; University of Massachusetts Amherst, Amherst, MA, USA; Bucknell University, Lewisburg, PA, USA; University of Massachusetts Amherst, Amherst, MA, USA",IEEE Transactions on Visualization and Computer Graphics,"27 Jun 2024","2024","30","7","3427","3443","Leaving the context of visualizations invisible can have negative impacts on understanding and transparency. While common wisdom suggests that recontextualizing visualizations with metadata (e.g., disclosing the data source or instructions for decoding the visualizations’ encoding) may counter these effects, the impact remains largely unknown. To fill this gap, we conducted two experiments. In Experiment 1, we explored how chart type, topic, and user goal impacted which categories of metadata participants deemed most relevant. We presented 64 participants with four real-world visualizations. For each visualization, participants were given four goals and selected the type of metadata they most wanted from a set of 18 types. Our results indicated that participants were most interested in metadata which explained the visualization's encoding for goals related to understanding and metadata about the source of the data for assessing trustworthiness. In Experiment 2, we explored how these two types of metadata impact transparency, trustworthiness and persuasiveness, information relevance, and understanding. We asked 144 participants to explain the main message of two pairs of visualizations (one with metadata and one without); rate them on scales of transparency and relevance; and then predict the likelihood that they were selected for a presentation to policymakers. Our results suggested that visualizations with metadata were perceived as more thorough than those without metadata, but similarly relevant, accurate, clear, and complete. Additionally, we found that metadata did not impact the accuracy of the information extracted from visualizations, but may have influenced which information participants remembered as important or interesting.","1941-0506","","10.1109/TVCG.2022.3231716","","https://ieeexplore.ieee.org/stamp/stamp.jsp?arnumber=9998319","Metadata;trust;transparency;understanding;visualization","Data visualization;Metadata;Encoding;Soft sensors;Stakeholders;Organizations;Data mining","","6","","104","IEEE","23 Dec 2022","","","IEEE","IEEE Journals"
"An Interactive Approach to Bias Mitigation in Machine Learning","H. Wang; S. Mukhopadhyay; Y. Xiao; S. Fang","Department of Computer & Information Science, Indiana University Purdue University, Indianapolis; Department of Computer & Information Science, Indiana University Purdue University, Indianapolis; School of Social Work, Indiana University; Department of Computer & Information Science, Indiana University Purdue University, Indianapolis",2021 IEEE 20th International Conference on Cognitive Informatics & Cognitive Computing (ICCI*CC),"4 Jul 2022","2021","","","199","205","Underrepresentation and misrepresentation of protected groups in the training data is a significant source of bias for Machine Learning (ML) algorithms, resulting in decreased confidence and trustworthiness of the generated ML models. Such bias can be mitigated by incorporating both objective as well as subjective (through human users) measures of bias, and compensating for them by means of a suitable selection algorithm over subgroups of training data. In this paper, we propose a methodology of integrating bias detection and mitigation strategies through interactive visualization of machine learning models in selected protected spaces. In this approach, a (partially generated) ML model performance is visualized and evaluated by a human user or a community of human users in terms of potential presence of bias using both objective and subjective criteria. Guided by such human feedback, the ML algorithm can implement a variety of remedial sampling strategies to mitigate the bias using an iterative human-in-the-loop approach. We also provide experimental results with a benchmark ML dataset to demonstrate that such an interactive ML approach holds considerable promise in detecting and mitigating bias in ML models.","","978-1-6654-2119-5","10.1109/ICCICC53683.2021.9811333","","https://ieeexplore.ieee.org/stamp/stamp.jsp?arnumber=9811333","fairness;bias;machine learning;visualization;human-computer interaction","Machine learning algorithms;Training data;Data visualization;Machine learning;Benchmark testing;Predictive models;Iterative algorithms","","3","","48","IEEE","4 Jul 2022","","","IEEE","IEEE Conferences"
"How Do Algorithmic Fairness Metrics Align with Human Judgement? A Mixed-Initiative System for Contextualized Fairness Assessment","R. Constantin; M. Dück; A. Alexandrov; P. Matošević; D. Keidar; M. El-Assady","ETH Zürich, Switzerland; ETH Zürich, Switzerland; ETH Zürich, Switzerland; ETH Zürich, Switzerland; ETH Zürich, Switzerland; ETH Zürich, Switzerland",2022 IEEE Workshop on TRust and EXpertise in Visual Analytics (TREX),"16 Dec 2022","2022","","","1","7","Fairness evaluation presents a challenging problem in machine learning, and is usually restricted to the exploration of various metrics that attempt to quantify algorithmic fairness. However, due to cultural and perceptual biases, such metrics are often not powerful enough to accurately capture what people perceive as fair or unfair. To close the gap between human judgement and automated fairness evaluation, we develop a mixed-initiative system named FairAlign, where laypeople assess the fairness of different classification models by analyzing expressive and interactive visualizations of data. Using the aggregated qualitative feedback, data scientists and machine learning experts can examine the similarities and the differences between predefined fairness metrics and human judgement in a contextualized setting. To validate the utility of our system, we conducted a small study on a socially relevant classification task, where six people were asked to assess the fairness of multiple prediction models using the provided visualizations. The results show that our platform is able to give valuable guidance for model evaluation in case of otherwise contradicting and indecisive metrics for algorithmic fairness.","","978-1-6654-9356-7","10.1109/TREX57753.2022.00005","","https://ieeexplore.ieee.org/stamp/stamp.jsp?arnumber=9974353","Algorithmic-fairness;Fairness-assessment;FairAlign;Visual-analytics-system;Human-judgement;Mixed-initiative;Contextualized-fairness","Measurement;Analytical models;Visual analytics;Machine learning;Predictive models;Prediction algorithms;Data models","","1","","36","IEEE","16 Dec 2022","","","IEEE","IEEE Conferences"
"Computational Offloading for Efficient Trust Management in Pervasive Online Social Networks Using Osmotic Computing","V. Sharma; I. You; R. Kumar; P. Kim","Department of Information Security Engineering, Soonchunhyang University, Asan-si, South Korea; Department of Information Security Engineering, Soonchunhyang University, Asan-si, South Korea; Computer Science and Engineering Department, Thapar University, Patiala, India; Department of Computer Engineering, Chosun University, Gwangju, South Korea",IEEE Access,"20 May 2017","2017","5","","5084","5103","Pervasive social networking (PSN) aims at bridging the gap between the services and users by providing a platform for social communication irrespective of the time and location. With the advent of a new era of high-speed telecommunication services, mobile users have evolved to a large extent demanding secure, private, and trustworthy services. Online social networks have evolved as pervasive online social networks (POSNs), which uses a common platform to connect users from hybrid applications. Trust has always been a concern for these networks. However, existing approaches tend to provide application-specific trust management, thus resulting in the cost of excessive network resource utilization and high computations. In this paper, a pervasive trust management framework is presented for POSNs, which is capable of generating high trust value between the users with a lower cost of monitoring. The proposed approach uses a flexible mixture model to develop the system around six different properties, and then utilizes the concept of osmotic computing to perform computational offloading, which reduces the number of computations as well as computational time. The novel concepts of lock door policy and intermediate state management procedure are used to allow trust visualization by providing efficient identification of trustworthy and untrustworthy users. The proposed approach is capable of predicting user ratings efficiently with extremely low errors, which are in the range of ±2. The effectiveness of the proposed approach is demonstrated using theoretical and numerical analyses along with data set-based simulations.","2169-3536","","10.1109/ACCESS.2017.2683159","Human Resource Training Program for Regional Innovation and Creativity through the Ministry of Education and National Research Foundation of Korea(grant numbers:NRF-2014H1C1A1073115); Soonchunhyang University Research Fund; ","https://ieeexplore.ieee.org/stamp/stamp.jsp?arnumber=7883896","Pervasive social networks;online social networks;trust management;osmotic computing;trust visualization","Social network services;Monitoring;Mobile communication;Peer-to-peer computing;Mixture models;Reliability;Mathematical model","","38","","32","OAPA","21 Mar 2017","","","IEEE","IEEE Journals"
"Mining Revision History to Assess Trustworthiness of Article Fragments","H. Zeng; M. A. Alhossaini; R. Fikes; D. L. McGuinness","Knowledge Systems, Al Lab, Department of Computer Science, University of Stanford, USA; Knowledge Systems, Al Lab, Department of Computer Science, University of Stanford, USA; Knowledge Systems, Al Lab, Department of Computer Science, University of Stanford, USA; Knowledge Systems, Al Lab, Department of Computer Science, University of Stanford, USA","2006 International Conference on Collaborative Computing: Networking, Applications and Worksharing","21 May 2007","2006","","","1","10","Wikis are a type of collaborative repository system that enables users to create and edit shared content on the Web. The popularity and proliferation of Wikis have created a new set of challenges for trust research because the content in a Wiki can be contributed by a wide variety of users and can change rapidly. Nevertheless, most Wikis lack explicit trust management to help users decide how much they should trust an article or a fragment of an article. In this paper, we investigate the dynamic nature of revisions as we explore ways of utilizing revision history to develop an article fragment trust model. We use our model to compute trustworthiness of articles and article fragments. We also augment Wikis with a trust view layer with which users can visually identify text fragments of an article and view trust values computed by our model","","1-4244-0428-2","10.1109/COLCOM.2006.361890","","https://ieeexplore.ieee.org/stamp/stamp.jsp?arnumber=4207562","Mining Revision History;Trust Computation;Trust Visualization;Wiki;Wikipedia","History;Wikipedia;Collaboration;Visualization;Knowledge based systems;Computer science;Bayesian methods;Encyclopedias;Natural languages;Computer vision","","13","","19","IEEE","21 May 2007","","","IEEE","IEEE Conferences"
