"Hue-Preserving Color Blending","J. Chuang; D. Weiskopf; T. Moller","GrUVi (Graphics, Usability and Viswalization Lab), Simon Fraser University, Burnaby, Canada; VISUS (Visualization Research Center, Universität Stuttgart, Germany; GrUVi (Graphics, Usability and Viswalization Lab), Simon Fraser University, Burnaby, Canada",IEEE Transactions on Visualization and Computer Graphics,"23 Oct 2009","2009","15","6","1275","1282","We propose a new perception-guided compositing operator for color blending. The operator maintains the same rules for achromatic compositing as standard operators (such as the over operator), but it modifies the computation of the chromatic channels. Chromatic compositing aims at preserving the hue of the input colors; color continuity is achieved by reducing the saturation of colors that are to change their hue value. The main benefit of hue preservation is that color can be used for proper visual labeling, even under the constraint of transparency rendering or image overlays. Therefore, the visualization of nominal data is improved. Hue-preserving blending can be used in any existing compositing algorithm, and it is particularly useful for volume rendering. The usefulness of hue-preserving blending and its visual characteristics are shown for several examples of volume visualization.","1941-0506","","10.1109/TVCG.2009.150","","https://ieeexplore.ieee.org/stamp/stamp.jsp?arnumber=5290739","image compositing;perceptual transparency;color blending;volume rendering;illustrative visualization","Data visualization;Transfer functions;Labeling;Rendering (computer graphics);Brightness;Histograms;Displays;Biomedical imaging;Computed tomography;Magnetic resonance imaging","Color;Computer Graphics;Diagnostic Imaging;Image Processing, Computer-Assisted","32","","35","IEEE","23 Oct 2009","","","IEEE","IEEE Journals"
"Perceptually-Based Depth-Ordering Enhancement for Direct Volume Rendering","L. Zheng; Y. Wu; K. -L. Ma","Department of Computer Science, University of California, Davis, CA; Microsoft Research Asia, Beijing, P.R. China; Department of Computer Science, University of California, Davis, CA",IEEE Transactions on Visualization and Computer Graphics,"9 Jan 2013","2013","19","3","446","459","Visualizing complex volume data usually renders selected parts of the volume semitransparently to see inner structures of the volume or provide a context. This presents a challenge for volume rendering methods to produce images with unambiguous depth-ordering perception. Existing methods use visual cues such as halos and shadows to enhance depth perception. Along with other limitations, these methods introduce redundant information and require additional overhead. This paper presents a new approach to enhancing depth-ordering perception of volume rendered images without using additional visual cues. We set up an energy function based on quantitative perception models to measure the quality of the images in terms of the effectiveness of depth-ordering and transparency perception as well as the faithfulness of the information revealed. Guided by the function, we use a conjugate gradient method to iteratively and judiciously enhance the results. Our method can complement existing systems for enhancing volume rendering results. The experimental results demonstrate the usefulness and effectiveness of our approach.","1941-0506","","10.1109/TVCG.2012.144","","https://ieeexplore.ieee.org/stamp/stamp.jsp?arnumber=6226392","Volume rendering;depth ordering;depth perception;transparency;visualization","Rendering (computer graphics);Junctions;Image color analysis;Transfer functions;Visualization;Optimization;Solid modeling","Algorithms;Computer Graphics;Depth Perception;Humans;Image Enhancement;Image Interpretation, Computer-Assisted;Imaging, Three-Dimensional;Numerical Analysis, Computer-Assisted;User-Computer Interface","25","","40","IEEE","26 Jun 2012","","","IEEE","IEEE Journals"
"A Visualization Approach for Adaptive Consent in the European Data Protection Framework","A. Rossi; M. Palmirani","CIRSFID, Alma Mater Studiorum University of Bologna, Bologna, Italy; CIRSFID, Alma Mater Studiorum University of Bologna, Bologna, Italy",2017 Conference for E-Democracy and Open Government (CeDEM),"21 Sep 2017","2017","","","159","170","For the first time in the history of European data protection law, the use of visualizations and especially of icons is explicitly suggested as a way to improve the comprehensibility of the information about data handling practices provided to the data subjects, which plays a crucial role to obtain informed consent. Privacy icon sets have already been developed, but they differ in the kinds of information they depict and in the perspectives they embed. Moreover, they have not met widespread adoption, one reasons being that research has shown that possibility of misinterpretation of these symbols. Our research relies on legal Semantic Web technologies and principles drawn from legal design and Human Computer Interaction to propose visualizations of privacy policies and consent forms. The final aim is to enhance the communication of data practices to users and to support their decision about whether to give or withhold consent.","","978-1-5090-6719-0","10.1109/CeDEM.2017.23","","https://ieeexplore.ieee.org/stamp/stamp.jsp?arnumber=8046282","Privacy;privacy policies;data protection;visualization;icons;GDPR;transparency;informed consent;usability;legal design","Law;Data visualization;Visualization;Data protection;Privacy","","16","","55","IEEE","21 Sep 2017","","","IEEE","IEEE Conferences"
"Interactive Grouping of Friends in OSN: Towards Online Context Management","B. Gao; B. Berendt; D. Clarke; R. De Wolf; T. Peetz; J. Pierson; R. Sayaf","Department of Computer Science, Katholieke Universiteit Leuven; Department of Computer Science, Katholieke Universiteit Leuven; Katholieke Universiteit Leuven, Leuven, Flanders, BE; SMIT - Studies on Media Information and Telecommunication, Vrije Universiteit Brussel; Department of Computer Science, Katholieke Universiteit Leuven; Vrije Universiteit Brussel, Brussel, Brussel, BE; Katholieke Universiteit Leuven, Leuven, Flanders, BE",2012 IEEE 12th International Conference on Data Mining Workshops,"10 Jan 2013","2012","","","555","562","In Online Social Networks (OSNs), it can be difficult to maintain the context of a conversation or action, i.e. to know what the situation is and how to act appropriately. The resulting uncertainties may lead to privacy issues. We focus on one issue Context Collision in this paper, and motivate that a first step to address this issue is to help users distinguish groups of contacts within their OSN accounts. We conducted a small user study to investigate the criteria of users grouping the people they know. We summarized our participants' strategy of labeling the groups and found that they perform the grouping mainly by their connections with others. We used these results in the design of FreeBu, a semi-automatic and interactive grouping tool, which is based on mining friend graph data for community detection and profile information for labeling.","2375-9259","978-1-4673-5164-5","10.1109/ICDMW.2012.88","","https://ieeexplore.ieee.org/stamp/stamp.jsp?arnumber=6406401","online social networks;privacy;transparency tool;context;visualization","Context;Communities;Facebook;Educational institutions;Privacy;Labeling","","10","","28","IEEE","10 Jan 2013","","","IEEE","IEEE Conferences"
"A Comparison of Rendering Techniques for 3D Line Sets With Transparency","M. Kern; C. Neuhauser; T. Maack; M. Han; W. Usher; R. Westermann","Computer Graphics & Visualization Group, Technische Universität München, Garching bei MÜnchen, Germany; Computer Graphics & Visualization Group, Technische Universität München, Garching bei MÜnchen, Germany; Computer Graphics & Visualization Group, Technische Universität München, Garching bei MÜnchen, Germany; Scientific Computing and Imaging Institute, University of Utah, Salt Lake City, UT, USA; Scientific Computing and Imaging Institute, University of Utah, Salt Lake City, UT, USA; Computer Graphics & Visualization Group, Technische Universität München, Garching bei MÜnchen, Germany",IEEE Transactions on Visualization and Computer Graphics,"30 Jun 2021","2021","27","8","3361","3376","This article presents a comprehensive study of rendering techniques for 3D line sets with transparency. The rendering of transparent lines is widely used for visualizing trajectories of tracer particles in flow fields. Transparency is then used to fade out lines deemed unimportant, based on, for instance, geometric properties or attributes defined along with them. Accurate blending of transparent lines requires rendering the lines in back-to-front or front-to-back order, yet enforcing this order for space-filling 3D line sets with extremely high-depth complexity becomes challenging. In this article, we study CPU and GPU rendering techniques for transparent 3D line sets. We compare accurate and approximate techniques using optimized implementations and several benchmark data sets. We discuss the effects of data size and transparency on quality, performance, and memory consumption. Based on our study, we propose two improvements to per-pixel fragment lists and multi-layer alpha blending. The first improves the rendering speed via an improved GPU sorting operation, and the second improves rendering quality via transparency-based bucketing.","1941-0506","","10.1109/TVCG.2020.2975795","","https://ieeexplore.ieee.org/stamp/stamp.jsp?arnumber=9007507","Scientific visualization;line rendering;order-independent transparency","Rendering (computer graphics);Ray tracing;Three-dimensional displays;Graphics processing units;Complexity theory;Acceleration;Image color analysis","","10","","44","IEEE","24 Feb 2020","","","IEEE","IEEE Journals"
"A Visualization Interface to Improve the Transparency of Collected Personal Data on the Internet","M. Schufrin; S. L. Reynolds; A. Kuijper; J. Kohlhammer","Fraunhofer IGD, Darmstadt, TU, Germany; Fraunhofer IGD, Darmstadt, TU, Germany; Fraunhofer IGD, Darmstadt, TU, Germany; Fraunhofer IGD, Darmstadt, TU, Germany",IEEE Transactions on Visualization and Computer Graphics,"28 Jan 2021","2021","27","2","1840","1849","Online services are used for all kinds of activities, like news, entertainment, publishing content or connecting with others. But information technology enables new threats to privacy by means of global mass surveillance, vast databases and fast distribution networks. Current news are full of misuses and data leakages. In most cases, users are powerless in such situations and develop an attitude of neglect for their online behaviour. On the other hand, the GDPR (General Data Protection Regulation) gives users the right to request a copy of all their personal data stored by a particular service, but the received data is hard to understand or analyze by the common internet user. This paper presents TransparencyVis - a web-based interface to support the visual and interactive exploration of data exports from different online services. With this approach, we aim at increasing the awareness of personal data stored by such online services and the effects of online behaviour. This design study provides an online accessible prototype and a best practice to unify data exports from different sources.","1941-0506","","10.1109/TVCG.2020.3028946","German Federal Ministry of Education and Research; Hessen State Ministry for Higher Education, Research; National Research Center for Applied Cybersecurity ATHENE; ","https://ieeexplore.ieee.org/stamp/stamp.jsp?arnumber=9246571","Information visualization;usable privacy;privacy awareness;transparency-enhancing technologies;user-centered design","Data visualization;Tools;Data privacy;Privacy;Internet;Data collection;Social networking (online)","","10","","59","IEEE","2 Nov 2020","","","IEEE","IEEE Journals"
"Advanced Rendering of Line Data with Ambient Occlusion and Transparency","D. Groß; S. Gumhold","Chair of Computer Graphics & Visualization, TU-Dresden, Dresden, Germany; Chair of Computer Graphics & Visualization, TU-Dresden, Dresden, Germany",IEEE Transactions on Visualization and Computer Graphics,"28 Jan 2021","2021","27","2","614","624","3D Lines are a widespread rendering primitive for the visualization of data from research fields like fluid dynamics or fiber tractography. Global illumination effects and transparent rendering improve the perception of three-dimensional features and decrease occlusion within the data set, thus enabling better understanding of complex line data. We present an efficient approach for high quality GPU-based rendering of line data with ambient occlusion and transparency effects. Our approach builds on GPU-based raycasting of rounded cones, which are geometric primitives similar to truncated cones, but with spherical endcaps. Object space ambient occlusion is provided by an efficient voxel cone tracing approach. Our core contribution is a new fragment visibility sorting strategy that allows for interactive visualization of line data sets with millions of line segments. We improve performance further by exploiting hierarchical opacity maps.","1941-0506","","10.1109/TVCG.2020.3028954","DFG though TRR 248(grant numbers:389792660); Clusters of Excellence CeTI (EXC2050/1)(grant numbers:390696704); PoL (EXC2068)(grant numbers:390729961); ","https://ieeexplore.ieee.org/stamp/stamp.jsp?arnumber=9216549","Scientific visualization;ray-casting;line rendering;transparency","Rendering (computer graphics);Geometry;Lighting;Data visualization;Electron tubes;Casting;Graphics processing units","","4","","48","IEEE","7 Oct 2020","","","IEEE","IEEE Journals"
"Memory-Hazard-Aware K-Buffer Algorithm for Order-Independent Transparency Rendering","N. Zhang","Environmental Modeling and Visualization Laboratory, Lockheed Martin Co, Chapel Hill, NC",IEEE Transactions on Visualization and Computer Graphics,"16 Dec 2013","2014","20","2","238","248","The $(k)$-buffer algorithm is an efficient GPU-based fragment level sorting algorithm for rendering transparent surfaces. Because of the inherent massive parallelism of GPU stream processors, this algorithm suffers serious read-after-write memory hazards now. In this paper, we introduce an improved $(k)$-buffer algorithm with error correction coding to combat memory hazards. Our algorithm results in significantly reduced artifacts. While preserving all the merits of the original algorithm, it requires merely OpenGL 3.x support from the GPU, instead of the atomic operations appearing only in the latest OpenGL 4.2 standard. Our algorithm is simple to implement and efficient in performance. Future GPU support for improving this algorithm is also proposed.","1941-0506","","10.1109/TVCG.2013.72","","https://ieeexplore.ieee.org/stamp/stamp.jsp?arnumber=6494571","volume visualization;Transparency rendering;visibility sort;memory hazard;error checking code;graphics processor","Rendering (computer graphics);Volume measurements;Error analysis;Computer graphics","","4","","16","IEEE","5 Apr 2013","","","IEEE","IEEE Journals"
"The Ghosting Technique Applied to Augmented Reality Visualization","A. Padilha; C. Rolim; V. Teichrieb","Voxar Labs Centro de Informática-UFPE, Recife, Brasil; Voxar Labs Centro de Informática-UFPE, Recife, Brasil; Voxar Labs Centro de Informática-UFPE, Recife, Brasil",2013 XV Symposium on Virtual and Augmented Reality,"7 Nov 2013","2013","","","159","166","Functional realism focuses on delivering to the user the best visual information from the target scene. The virtual scenes/objects do not need to behave or look like the real ones, but they need to help users in tasks execution. In this sense, this paper focuses on functional realism applied to Augmented Reality scenes. The technique presented here applies a visualization technique called Ghosting to generate an importance map from the real scene in order to blend in the virtual objects in a more adequate way. A careless augmentation can prejudice the user Augmented Reality based experience. The importance map is built from a saliency map, edge detection, super pixel representation and texture analysis. We present results in outdoor and indoor environments in order to prove the technique effectiveness.","","978-0-7695-5001-5","10.1109/SVR.2013.36","","https://ieeexplore.ieee.org/stamp/stamp.jsp?arnumber=6655774","Augmented Reality;Ghosting Technique;Visualization;Transparency;Saliency Map","Visualization;Image segmentation;Augmented reality;Pipelines;Art;Abstracts;Image edge detection","","4","","22","IEEE","7 Nov 2013","","","IEEE","IEEE Conferences"
"A Visualization Interface to Improve the Transparency of Collected Personal Data on the Internet","M. Schufrin; S. L. Reynolds; A. Kuijper; J. Kohlhammer","Fraunhofer IGD, Germany; Fraunhofer IGD, Germany; Fraunhofer IGD, TU Darmstadt, Germany; Fraunhofer IGD, TU Darmstadt, Germany",2020 IEEE Symposium on Visualization for Cyber Security (VizSec),"9 Feb 2021","2020","","","1","10","Online services are used for all kinds of activities, like news, entertainment, publishing content or connecting with others. But information technology enables new threats to privacy by means of global mass surveillance, vast databases and fast distribution networks. Current news are full of misuses and data leakages. In most cases, users are powerless in such situations and develop an attitude of neglect for their online behaviour. On the other hand, the GDPR (General Data Protection Regulation) gives users the right to request a copy of all their personal data stored by a particular service, but the received data is hard to understand or analyze by the common internet user. This paper presents TransparencyVis - a web-based interface to support the visual and interactive exploration of data exports from different online services. With this approach, we aim at increasing the awareness of personal data stored by such online services and the effects of online behaviour. This design study provides an online accessible prototype and a best practice to unify data exports from different sources.","2639-4332","978-1-7281-8262-9","10.1109/VizSec51108.2020.00007","Ministry of Education; ","https://ieeexplore.ieee.org/stamp/stamp.jsp?arnumber=9347416","Information visualization;usable privacy;privacy awareness;transparency-enhancing technologies;user-centered design","Visualization;Publishing;Surveillance;Data visualization;Prototypes;Internet;General Data Protection Regulation","","3","","59","IEEE","9 Feb 2021","","","IEEE","IEEE Conferences"
"Visualization of processes in self-learning systems","G. Peters; K. Bunte; M. Strickert; M. Biehl; T. Villmann","Human-Computer Interaction, FernUniversität in Hagen, Germany; CITEC-Cognitive Interaction Technology Center of Excellence, Bielefeld University, Germany; Department of Computer Science and Mathematics, University of Marburg, Germany; Johann Bernoulli Inst. for Mathematics & Computer Science, University of Groningen, The Netherlands; Computational Intelligence Group, University of Applied Sciences Mittweida, Germany","2012 Tenth Annual International Conference on Privacy, Security and Trust","13 Sep 2012","2012","","","244","249","One aspect of self-organizing systems is their desired ability to be self-learning, i.e., to be able to adapt dynamically to conditions in their environment. This quality is awkward especially if it comes to applications in security or safety-sensitive areas. Here a step towards more trustful systems could be taken by providing transparency of the processes of a system. An important means of giving feedback to an operator is the visualization of the internal processes of a system. In this position paper we address the problem of visualizing dynamic processes especially in self-learning systems. We take an existing self-learning system from the field of computer vision as an example from which we derive questions of general interest such as possible options to visualize the flow of information in a dynamic learning system or the visualization of symbolic data. As a side effect the visualization of learning processes may provide a better understanding of underlying principles of learning in general, i.e, also in biological systems. That may also facilitate improved designs of future self-learning systems.","","978-1-4673-2326-0","10.1109/PST.2012.6297953","","https://ieeexplore.ieee.org/stamp/stamp.jsp?arnumber=6297953","Visualization of dynamic processes;transparency and controllability of self-organization processes;self-learning systems;symbolic representations","Visualization;Data visualization;Learning systems;Shape;Electronic mail;Machine learning;Security","","2","","21","IEEE","13 Sep 2012","","","IEEE","IEEE Conferences"
"On visualizing threat evaluation configuration processes: A design proposal","M. Riveiro; M. Lebram; H. Warston","Informatics Research Centre, University of Skövde, Sweden; Informatics Research Centre, University of Skövde, Sweden; Saab AB, Saab Electronic Defence Systems, Gothenburg, Sweden",17th International Conference on Information Fusion (FUSION),"7 Oct 2014","2014","","","1","8","Threat evaluation is concerned with estimating the intent, capability and opportunity of detected objects in relation to our own assets in an area of interest. To infer whether a target is threatening and to which degree is far from a trivial task. Expert operators have normally to their aid different support systems that analyze the incoming data and provide recommendations for actions. Since the ultimate responsibility lies in the operators, it is crucial that they trust and know how to configure and use these systems, as well as have a good understanding of their inner workings, strengths and limitations. To limit the negative effects of inadequate cooperation between the operators and their support systems, this paper presents a design proposal that aims at making the threat evaluation process more transparent. We focus on the initialization, configuration and preparation phases of the threat evaluation process, supporting the user in the analysis of the behavior of the system considering the relevant parameters involved in the threat estimations. For doing so, we follow a known design process model and we implement our suggestions in a proof-of-concept prototype that we evaluate with military expert system designers.","","978-8-4901-2355-3","","","https://ieeexplore.ieee.org/stamp/stamp.jsp?arnumber=6916152","threat evaluation;transparency;visualization;design;high-level information fusion;decision-making","Prototypes;Weapons;Proposals;Guidelines;Human computer interaction;Estimation;Data models","","","","33","","7 Oct 2014","","","IEEE","IEEE Conferences"
"Multidimensional Data Visualization for Investigation of Skin Transparency","A. Tochigi; T. Itoh","Grad. School of Humanities and Sciences, Ochanomizu University, Tokyo, Japan; Grad. School of Humanities and Sciences, Ochanomizu University, Tokyo, Japan",2021 25th International Conference Information Visualisation (IV),"28 Oct 2021","2021","","","7","12","“Skin Transparency” is an important keyword for women of all generations as one of the conditions for beautiful skin. Although, no one has clear definitions of “Skin Transparency”. As it stands, beauty experts are often invited to use visual methods in conducting skin transparency evaluation; however, it has not been still sufficiently clarified which visual properties are related to skin transparency. In this study, we aim to discover the relations between skin image features and sensory evaluations applying real human skin images. Specifically, we investigate “Skin Transparency” by comparing them using the Parallel Coordinate Plots. We observed their complex distributions by the visualization task.","2375-0138","978-1-6654-3827-8","10.1109/IV53921.2021.00012","","https://ieeexplore.ieee.org/stamp/stamp.jsp?arnumber=9582719","Human Skin;Transparency;Sensory Evaluation;Image Analysis;Multidimensional Data Visualization","Visualization;Data visualization;Skin;Task analysis","","","","11","IEEE","28 Oct 2021","","","IEEE","IEEE Conferences"
"Visualizing compiled executables for malware analysis","D. A. Quist; L. M. Liebrock","Los Alamos National Laboratory, New Mexico Technology, USA; New Mexico Technology, USA",2009 6th International Workshop on Visualization for Cyber Security,"8 Jan 2010","2009","","","27","32","Reverse engineering compiled executables is a task with a steep learning curve. It is complicated by the task of translating assembly into a series of abstractions that represent the overall flow of a program. Most of the steps involve finding interesting areas of an executable and determining their overall functionality. This paper presents a method using dynamic analysis of program execution to visually represent the overall flow of a program. We use the Ether hypervisor framework to covertly monitor a program. The data is processed and presented for the reverse engineer. Using this method the amount of time needed to extract key features of an executable is greatly reduced, improving productivity. A preliminary user study indicates that the tool is useful for both new and experienced users.","","978-1-4244-5413-6","10.1109/VIZSEC.2009.5375539","","https://ieeexplore.ieee.org/stamp/stamp.jsp?arnumber=5375539","Reverse Engineering;Visualization;Dynamic Analysis;K.6.1 [Management of Computing and Information Systems]: Project and People Management-Life Cycle;K.7.m [The Computing Profession]: Miscellaneous-Ethics","Reverse engineering;Data visualization;Assembly;Monitoring;Productivity;Project management;Engineering management;Electronic mail;Laboratories;Virtual machine monitors","","44","1","23","IEEE","8 Jan 2010","","","IEEE","IEEE Conferences"
