"A Data Analytics Methodology to Visually Analyze the Impact of Bias and Rebalancing","A. Lavalle; A. Mate; J. Trujillo; M. A. Teruel","Department of Software and Computing Systems, Lucentia Research Group, University of Alicante, San Vicente del Raspeig, Alicante, Spain; Department of Software and Computing Systems, Lucentia Research Group, University of Alicante, San Vicente del Raspeig, Alicante, Spain; Department of Software and Computing Systems, Lucentia Research Group, University of Alicante, San Vicente del Raspeig, Alicante, Spain; Department of Software and Computing Systems, Lucentia Research Group, University of Alicante, San Vicente del Raspeig, Alicante, Spain",IEEE Access,"13 Jun 2023","2023","11","","56691","56702","Data Analytics have become a key component of many business processes which influence several aspects of our daily life. Indeed, any misinterpretation or flaw in the outputs of Data Analytics results can cause significant damage, specialy when dealing with one of the most often overlooked issues, namely the unaware use of biased data. When data bias goes unadverted, it warps the meaning of data, having a devastating effect on Data Analytics results. Although it is widely argued that the most common manner to deal with data bias is to rebalance biased datasets, it is not an aseptic transformation, leading to several potentially undesired side-effects that will probably harm the result of data analyses. Therefore, in order to analyze the underlying bias in datasets, in this work we present (i) a comprehensive methodology based on visualization techniques, which assists users in the definition of their analytical requirements to detect and visually represent the data bias automatically helping them to find out whether it is appropriate to artificially rebalance their dataset or not; (ii) a novel metamodel for visually representing bias; (iii) a motivating real-world running example used to analyze the impact of bias in Data Analytics and (iv) an assessment of the improvements introduced by our proposal through a complete real-world case study by using a Fire Department Calls for Service dataset, thus demonstrating that rebalancing datasets is not always the best option. It is crucial to study the context where the decisions are going to be taken. Moreover, it is also important to do a pre-analysis with the aim of knowing the nature of the datasets and how biased they are.","2169-3536","","10.1109/ACCESS.2023.3279732","AETHER-UA Project, a smart data holistic approach for context-aware data analytics: Smarter machine learning for business modeling and analytics, funded by the Spanish Ministry of Science and Innovation(grant numbers:PID2020-112540RB-C43); BALLADEER Project, A Big dAta anaLytical pLatform for the diagnosis and treatment of Attention deficit hyperactivity Disorder (ADHD) featuring ExtendEd Reality funded by Conselleria de Innovación, Universidades, Ciencia y Sociedad Digital (Generalitat Valenciana)(grant numbers:PROMETEO/2021/088); ","https://ieeexplore.ieee.org/stamp/stamp.jsp?arnumber=10132458","Data analytics;data bias;data visualization;model-driven development;requirements engineering;artificial intelligence","Data models;Data visualization;Training;Proposals;Analytical models;Visualization;Training data","","1","","56","CCBYNCND","24 May 2023","","","IEEE","IEEE Journals"
"Potential Perils of Biological Sequence Visualization Using Sequence Logo","L. N. Kion; O. Y. Bee","Faculty of Cognitive Sciences & Human Development, Universiti Malaysia Sarawak, Kota Samarahan, Sarawak; Faculty of Cognitive Sciences & Human Development, Universiti Malaysia Sarawak, Kota Samarahan, Sarawak","2013 10th International Conference Computer Graphics, Imaging and Visualization","11 Nov 2013","2013","","","106","111","Sequence motif's characteristics are commonly visualized by using a sequence logo. This paper describes a user study aimed at evaluating the effectiveness of sequence logo as evaluation metric for motif prediction tools. We also investigate the nature of confirmation biases in using sequence logos in result reporting in publications. While sequence logos have been widely used for visualizing sequence motifs in the past 20 years, no study has reported its effectiveness and possible misuses in decision making. We conducted a paper-and-pencil test to determine the effectiveness of sequence logos in some of their common usages. A survey study was also performed to investigate sequence logos' learn ability. We found that there are great mismatches between users' perception and actual quality of motifs when sequence logos were used as an evaluation metric. Therefore, evaluation of motif prediction tools based on sequence logos has to be interpreted cautiously. Our result also suggests that there are still room for improvements in the current sequence logo's layout design.","","978-0-7695-5051-0","10.1109/CGIV.2013.26","","https://ieeexplore.ieee.org/stamp/stamp.jsp?arnumber=6658172","sequence logo;motif visualization;confirmation bias","Visualization;DNA;Measurement;Color;Decision making;Proteins;Usability","","","","18","IEEE","11 Nov 2013","","","IEEE","IEEE Conferences"
"Visualizing Model Behaviors for Clinic Users: Explaining A Clinical Prediction Model for 30-day Readmission after Inpatient Alcohol Dependence Treatment","O. S. Liang; C. C. Yang; K. Gliske; J. Braughton; Q. Ngo","College of Computing and Informatics, Drexel University, Philadelphia, U.S.A; College of Computing and Informatics, Drexel University, Philadelphia, U.S.A; Butler Center for Research, Hazelden Betty Ford Foundation, Center City, U.S.A; Butler Center for Research, Hazelden Betty Ford Foundation, Center City, U.S.A; Butler Center for Research, Hazelden Betty Ford Foundation, Center City, U.S.A",2024 IEEE 12th International Conference on Healthcare Informatics (ICHI),"22 Aug 2024","2024","","","718","724","Machine learning models for predicting alcohol use relapse lack adequate explanations. This study aims to utilize visualization techniques to (1) highlight a machine learning model's predictive reasoning and biases; and (2) to identify the risk factors associated with readmission following inpatient treatment for alcohol use disorder. Our visualizations show that first, the model was reliable in its negative predictions but had difficulty in correctly identifying positive instances with missing variable values; second, a history of multiple treatments may distinguish otherwise similar instances; and third, highly impactful risk factors for 30-day readmission included a history of multiple treatments and lower participation in treatment. The visualizations when considered together could help clinical users understand model biases.","2575-2634","979-8-3503-8373-7","10.1109/ICHI61247.2024.00114","","https://ieeexplore.ieee.org/stamp/stamp.jsp?arnumber=10628804","explainable artificial intelligence;visualization;model bias;clinical prediction model;alcohol use disorder;relapse","Visualization;Machine learning;Mental health;Medical services;Predictive models;Cognition;History","","","","32","IEEE","22 Aug 2024","","","IEEE","IEEE Conferences"
"The Role of Text in Visualizations: How Annotations Shape Perceptions of Bias and Influence Predictions","C. Stokes; C. X. Bearfield; M. A. Hearst","University of California Berkeley, Berkeley, CA, USA; Georgia Institute of Technology, Atlanta, GA, USA; University of California Berkeley, Berkeley, CA, USA",IEEE Transactions on Visualization and Computer Graphics,"4 Sep 2024","2024","30","10","6787","6800","This paper investigates the role of text in visualizations, specifically the impact of text position, semantic content, and biased wording. Two empirical studies were conducted based on two tasks (predicting data trends and appraising bias) using two visualization types (bar and line charts). While the addition of text had a minimal effect on how people perceive data trends, there was a significant impact on how biased they perceive the authors to be. This finding revealed a relationship between the degree of bias in textual information and the perception of the authors’ bias. Exploratory analyses support an interaction between a person's prediction and the degree of bias they perceived. This paper also develops a crowdsourced method for creating chart annotations that range from neutral to highly biased. This research highlights the need for designers to mitigate potential polarization of readers’ opinions based on how authors’ ideas are expressed.","1941-0506","","10.1109/TVCG.2023.3338451","Allen Institute for Artificial Intelligence; NSF(grant numbers:IIS-2237585,IIS-2311575); National Science Foundation Graduate Research Fellowship Program(grant numbers:DGE 2146752); ","https://ieeexplore.ieee.org/stamp/stamp.jsp?arnumber=10337772","Annotation;judgment;perceived bias;prediction;text;visualization","Ear;Annotations;Appraisal;Data visualization;Voting;Task analysis;Market research","","","","50","IEEE","1 Dec 2023","","","IEEE","IEEE Journals"
"Human machine interface in the Internet of Things (IoT)","J. Nuamah; Y. Seong","Department of Industrial and Systems Engineering, North Carolina A&T State University, Greensboro, NC, USA; Department of Industrial and Systems Engineering, North Carolina A&T State University, Greensboro, NC, USA",2017 12th System of Systems Engineering Conference (SoSE),"31 Jul 2017","2017","","","1","6","Humans would play a central role in IoT systems. The human operator represents one of the most vulnerable in the IoT system, one who can easily be overlooked. In the present study, we sought to accentuate human-in-the-loop issues in System of Systems, and in particular IoT systems through reviewing relevant literature from various perspectives. Some of the issues we highlighted include information visualization, cognition and human trust in intelligent systems. We also explained how neuroergonomics approaches may be employed together with traditional behavioral and subjective measures to improve human-IoT device interactions.","","978-1-5090-5945-4","10.1109/SYSOSE.2017.7994979","","https://ieeexplore.ieee.org/stamp/stamp.jsp?arnumber=7994979","Human-in-the-loop;Internet of Things (IoT);Information Visualization;Trust;Neuroergonomics","Data integration;Automation;Human computer interaction;Data visualization;Internet of Things;Wireless sensor networks","","18","","48","IEEE","31 Jul 2017","","","IEEE","IEEE Conferences"
"Visualizing non-functional requirements","N. A. Ernst; Y. Yu; J. Mylopoulos","Department of Computer Science, University of Toronto, Toronto, Canada; Department of Computer Science, University of Toronto, Toronto, Canada; Department of Computer Science, University of Toronto, Toronto, Canada",2006 First International Workshop on Requirements Engineering Visualization (REV'06 - RE'06 Workshop),"11 Dec 2006","2006","","","2","2","Information systems can be visualized with many tools. Typically these tools present functional artifacts from various phases of the development life-cycle; these include requirements models, architecture and design diagrams, and implementation code. The syntactic structures of these artifacts are often presented in a textual language using symbols, or a graphical one using nodes and edges. In this paper, we propose a quality-based visualization scheme. Such a scheme is layered on top of these functional artifacts for presenting non-functional aspects of the system. To do this, we use quantified quality attributes. As an example, we visualize the quality attributes of trust and performance among various nonfunctional requirements of information systems.","","0-7695-2711-6","10.1109/REV.2006.10","","https://ieeexplore.ieee.org/stamp/stamp.jsp?arnumber=4026783","quality attributes visualization;nonfunctional;requirements;tradeoffs;performance;trust","Visualization;Software tools;Unified modeling language;Software systems;Software quality;Information systems;Open source software;Scattering;Information security;Software performance","","17","","29","IEEE","11 Dec 2006","","","IEEE","IEEE Conferences"
"Building Confidence in Information-Trustworthiness Metrics for Decision Support","J. R. C. Nurse; I. Agrafiotis; S. Creese; M. Goldsmith; K. Lamberts","Department of Psychology, University of Warwick, UK; Department of Computer Science, University of Oxford, UK; Department of Computer Science, University of Oxford, UK; Department of Computer Science, University of Oxford, UK; Department of Psychology, University of Warwick, UK","2013 12th IEEE International Conference on Trust, Security and Privacy in Computing and Communications","12 Dec 2013","2013","","","535","543","In light of the significant amount of information available online today and its potential application to a range of situations, the importance of identifying trustworthy information, and secondly, of building user confidence in that information is paramount. With this in mind, we have developed a novel trustworthiness metric which is designed to provide a relative score based on several key factors that influence trust, such as information's provenance and quality, and the integrity of the infrastructure through which the information passes. In this paper we consider whether providing insight into the various factors that make-up the resulting trustworthiness score actually helps to build trust in the metric itself, and whether users can successfully understand the advice being conveyed. Specifically, we present here the results of experiments which explore whether or not the visual interface that enables users to understand how the metric is composed of a combination of scores, across a range of factors, is a feature they are cognitively able to process, and whether it might help to build confidence in the trustworthiness advice being provided.","2324-9013","978-0-7695-5022-0","10.1109/TrustCom.2013.6","","https://ieeexplore.ieee.org/stamp/stamp.jsp?arnumber=6680884","Trust metrics;trustworthiness visualisation;decision-making;risk communication;information quality","Context;Buildings;Interviews;Visualization;Atmospheric measurements;Particle measurements","","9","","23","IEEE","12 Dec 2013","","","IEEE","IEEE Conferences"
"Understanding Cancer-Based Networks in Twitter Using Social Network Analysis","D. Murthy; A. Gross; D. Oliveira","Sociology Department, Social Innovation Laboratory, Bowdoin College, Brunswick, ME, USA; Sociology Department, Social Innovation Laboratory, Bowdoin College, Brunswick, ME, USA; Computer Science Department, Bowdoin College, Brunswick, ME, USA",2011 IEEE Fifth International Conference on Semantic Computing,"27 Oct 2011","2011","","","559","566","Web-based social media networks have an increasing frequency of health-related information, resources, and networks (both support and professional). Although we are aware of the presence of these health networks, we do not yet know their ability to (1) influence the flow of health-related behaviors, attitudes, and information and (2) what resources have the most influence in shaping particular health outcomes. Lastly, the health research community lacks easy-to-use data gathering tools to conduct applied research using data from social media websites. In this position paper we discuss and sketch our current work on addressing fundamental questions about information flow in cancer-related social media networks by visualizing and understanding authority, trust, and cohesion. We discuss the development of methods to visualize these networks and information flow on them using real-time data from the social media website Twitter and how these networks influence health outcomes by examining responses to specific health messages.","","978-1-4577-1648-5","10.1109/ICSC.2011.51","","https://ieeexplore.ieee.org/stamp/stamp.jsp?arnumber=6061372","social network analysis;virtual social networks;cancer-based Twitter networks;data visualization;trust inference;information-flow","Twitter;Cancer;Media;Data visualization;Peer to peer computing","","7","","67","IEEE","27 Oct 2011","","","IEEE","IEEE Conferences"
"Digital Evolution: blockchain field research","C. Bernardino; C. J. Costa; M. Aparício","ISEG – Lisbon School of Economics & Management, University of Lisbon, Lisbon, Portugal; Advance/CSG, ISEG – Lisbon School of Economics & Management, University of Lisbon, Lisbon, Portugal; NOVA Information Management School (NOVA IMS), Universidade Nova de Lisboa, Lisbon, Portugal",2022 17th Iberian Conference on Information Systems and Technologies (CISTI),"14 Jul 2022","2022","","","1","6","Blockchain is a relatively new technology supported by a decentralized database that received special attention at the research level in the last years due to its fundamental characteristics. Numerous researchers have applied blockchain studies in many fields, but the scope is very large and there is no delimitation of new and emergent trends. The method used to better understand the evolution and impact of blockchain technology was a bibliometric analysis. A search was conducted at digital Elsevier’s database with a single keyword blockchain, and 23383 articles were collected. The study uses cluster analysis method, allowing to construct and visualize bibliometric networks and to build co-occurrences networks. The results indicate that there are positive correlations between countries, that China and the United States are part of the most influential cluster. Indicates also emerging developments in the areas of governance, industry, decision-making processes, management, internet of things, information security, and a new hot topic, energy.","2166-0727","978-9-8933-3436-2","10.23919/CISTI54924.2022.9820035","","https://ieeexplore.ieee.org/stamp/stamp.jsp?arnumber=9820035","Blockchain;management;trust;bibliometrics;processes;keyword networks;visualization networks","Industries;Text mining;Correlation;Databases;Bibliometrics;Information security;Market research","","5","","26","","14 Jul 2022","","","IEEE","IEEE Conferences"
"Trust in the European Central Bank: Using Data Science and predictive Machine Learning Algorithms","A. Skirka; B. Adamyk; O. Adamyk; M. Valytska","Department of Banking, Ternopil National Economic University, Ternopil, Ukraine; Department of Banking, Ternopil National Economic University, Ternopil, Ukraine; Department of Economic and Audit, Ternopil National Economic University, Ternopil, Ukraine; Ternopil Volodymyr Hnatiuk, National Pedagogical University, Ternopil, Ukraine",2020 10th International Conference on Advanced Computer Information Technologies (ACIT),"30 Sep 2020","2020","","","356","361","Purpose: This empirical scientific research project aims to apply data science and machine learning tools to determine the influence of different factors on the level of trust in the European Central Bank. This research based on the data from the European Commission's Eurobarometer Survey 89. The paper also aims to represent some predictive analytics techniques to anticipate the level of confidence towards cental bank. Besides that, we build a couple of data visualizing plots, in order to show the main significant impact on the dependent variable. We created the ECB TrustMap Plot, correlation heatmap matrix and Alluvial diagram. Using this plots, we represented changes in network structure over people responses and decision making. Methodology: to calculate the index of trust in the central bank we used Logistic Regressioin, Decision Tree, Random Forrest and Neural Network models. Verify the output and results by using the VIF of the Logistic Model, Cross-validation, Confusion matrix, ROC-curves and accuracy estimations. Main Findings: trust in one-single currency, inflation problems, expectations about the future of EU, indicator of happiness and other indicators has a significant impact on the the level of trust in the central bank.","","978-1-7281-6760-2","10.1109/ACIT49673.2020.9208857","","https://ieeexplore.ieee.org/stamp/stamp.jsp?arnumber=9208857","Data Science;Machine Learning Algorithms;data visualization;predictive analytics;trust;central bank","Europe;Banking;Machine learning algorithms;Economics;Logistics;Correlation;Data visualization","","3","","10","IEEE","30 Sep 2020","","","IEEE","IEEE Conferences"
"Analysis of Trust in Ukrainian banks based on Machine Learning Algorithms","B. Adamyk; A. Skirka; K. Snihur; O. Adamyk","Department of Banking, Ternopil National Economic University, Ternopil, Ukraine; Department of Banking, Ternopil National Economic University, Ternopil, Ukraine; Ivano-Frankivsk Education and Research Institute of Management Ternopil National Economic University, Ivano-Frankivsk, Ukraine; Department of Economic Evaluation and Business Audit, Ternopil National Economic University, Ternopil, Ukraine",2019 9th International Conference on Advanced Computer Information Technologies (ACIT),"1 Aug 2019","2019","","","234","239","Purpose: This paper aims to conduct a thorough analysis to determine the influence of several possible factors on the level of confidence in Ukrainian banks. This scientific research project is based on data from the World Values Survey (WVS). The paper also aims to empirically investigate a number of independent variables, that creates trust in banks, based on Machine Learning Algorithms. Besides that, use some of the predictive analytics techniques to anticipate the level of trust in Ukrainian banks. Methodology: to calculate the index of Confidence in Banks var., by using linear regression, logistic regression (as a robustness check), Random Forrest, Decision Tree and XGBoost Models. Verify the output and results by using the Residual graphs, Cross-validation, Confusion matrix, ROC and model accuracy estimations. Main Findings: age, level of financial satisfaction, scale income and life satisfaction, general trust, lack of cash and other indicators has a significant impact on the the level of trust in Ukrainian banks. This paper represents a number and probability value of the variables spectrum; effect plots and other visualization graphs.","","978-1-7281-0450-8","10.1109/ACITT.2019.8779974","","https://ieeexplore.ieee.org/stamp/stamp.jsp?arnumber=8779974","trust in banks;data science;Machine Learning Algorithm;data visualization;deposit guarantee;bank run","Banking;Biological system modeling;Data visualization;Machine learning algorithms;Economics;Education;Linear regression","","3","","8","IEEE","1 Aug 2019","","","IEEE","IEEE Conferences"
"Visualizing and Aggregating Behavior for Trust Evaluation","G. Hadjichristofi; G. Varveris","Department of Computer Science and Engineering, European University Cyprus, Nicosia, Cyprus; Department of Electrical and Computer Engineering and Informatics, Frederick University, Nicosia/Limassol, Cyprus",2019 IEEE 24th International Workshop on Computer Aided Modeling and Design of Communication Links and Networks (CAMAD),"7 Oct 2019","2019","","","1","6","The Internet of Things or more broadly the Internet of Everything is becoming a possibility in the near future. A vast number of entities (i.e., devices, people, processes etc.) will require to connect to the Internet. These communications could be facilitated by new technologies, such as 5G communication, which aim to be faster by providing higher bandwidth guarantees. This higher network capacity will increase exponentially the volume of data that could be extracted from the Internet regarding individual user or entities' behavior and concurrently the number of attacks that could be deployed. Thus, it is becoming increasing challenging to evaluate the trustworthiness of entities on the Internet. The contribution of this paper is a new methodology of aggregating behavior that aids in evaluating individual trust. We introduce a basic methodology for calculating Trust, which is later extended through clustering of malicious events. Based on the proposed methodology, a GUI is implemented that allows the quick and easy visualization of malicious behavior with the corresponding trust calculation. Overall, this work aims to support existing trust models in terms of aggregating behavior and translating it into trustworthiness.","2378-4873","978-1-7281-1016-5","10.1109/CAMAD.2019.8858434","","https://ieeexplore.ieee.org/stamp/stamp.jsp?arnumber=8858434","behavior;visualization;trust","Mathematical model;Internet of Things;Measurement;Computer hacking;5G mobile communication;Graphical user interfaces","","2","","13","IEEE","7 Oct 2019","","","IEEE","IEEE Conferences"
